{
  "schemaVersion": "1.0.0-draft",
  "mediaType": "application/vnd.agentsuite.tool.provider.composition.v1+json",
  "id": "opa",
  "version": "1.0.0",
  "manifestDigest": "sha256:dddddddddddddddddddddddddddddddddddddddddddddddddddddddddddddddd",
  "platform": {
    "os": "linux",
    "architecture": "amd64"
  },
  "variantDigest": "sha256:aaaaaaaaaaaaaaaaaaaaaaaaaaaaaaaaaaaaaaaaaaaaaaaaaaaaaaaaaaaaaaaa",
  "buildProfile": "default"
}
